This is only a test: A virtual ecosystem for crashing (and restoring) the biosphere,https://blogs.microsoft.com/ai/this-is-only-a-test-a-virtual-ecosystem-for-crashing-and-restoring-the-biosphere/
“I’m deaf. I’m British. Be warned.”,https://blogs.microsoft.com/ai/im-deaf-im-british-be-warned/
The kids are (still) alright,https://blogs.microsoft.com/ai/the-kids-are-still-alright/
A kitchen appliance that epitomizes cool,https://blogs.microsoft.com/ai/a-kitchen-appliance-that-epitomizes-cool/
Get to know Microsoft’s Galactic Viceroy of Research Excellence,https://blogs.microsoft.com/ai/get-to-know-microsofts-galactic-viceroy-of-research-excellence/
Jamming at the corner of Cloud and Mobile,https://blogs.microsoft.com/ai/jamming-at-the-corner-of-cloud-and-mobile/
"At TED, Worldwide Telescope uses Oculus Rift to let attendees experience the universe",https://blogs.microsoft.com/ai/at-ted-worldwide-telescope-uses-oculus-rift-to-let-attendees-experience-the-universe/
Why does Microsoft spend time making predictions?,https://blogs.microsoft.com/ai/why-does-microsoft-spend-time-making-predictions/
Smart technology and fashion merge in a skirt made of Nokia Lumia 1520 phones,https://blogs.microsoft.com/ai/smart-technology-and-fashion-merge-in-a-skirt-made-of-nokia-lumia-1520-phones/
SFTW: UK studio introduces 'epic' online gaming experience,https://blogs.microsoft.com/ai/sftw-uk-studio-introduces-epic-online-gaming-experience/
3 reasons why Internet memes are changing the world,https://blogs.microsoft.com/ai/3-reasons-why-internet-memes-are-changing-the-world/
Makerbot teams up to print 3D mechanical hands,https://blogs.microsoft.com/ai/makerbot-teams-up-to-print-3d-mechanical-hands/
Want to totally win your Oscar pool? Talk to this guy,https://blogs.microsoft.com/ai/want-to-totally-win-your-oscar-pool-talk-to-this-guy/
A 3D-printed robotic suit that gives back the gift of mobility,https://blogs.microsoft.com/ai/a-3d-printed-robotic-suit-that-gives-back-the-gift-of-mobility/
The Garage: Microsoft’s “Central Park”,https://blogs.microsoft.com/ai/the-garage-microsofts-central-park/
Oculus Rift can turn any setting into a zombie-infested battlefield,https://blogs.microsoft.com/ai/oculus-rift-can-turn-any-setting-into-a-zombie-infested-battlefield/
Power BI for Office 365 Delivers “Frictionless” Access to Data Analytics Tools,https://blogs.microsoft.com/ai/power-bi-for-office-365-delivers-frictionless-access-to-data-analytics-tools/
Forthcoming Nokia Lumia Icon shows the possibilities of smartphone audio,https://blogs.microsoft.com/ai/forthcoming-nokia-lumia-icon-shows-the-possibilities-of-smartphone-audio/
Big insights from big data at the World Economic Forum 2014,https://blogs.microsoft.com/ai/big-insights-from-big-data-at-the-world-economic-forum-2014/
Designing Xbox One: The inside story,https://blogs.microsoft.com/ai/designing-xbox-one-the-inside-story/
Why architects love Surface Pro,https://blogs.microsoft.com/ai/why-architects-love-surface-pro/
NASA + Kinect + Oculus Rift,https://blogs.microsoft.com/ai/nasa-kinect-oculus-rift/
WorldWide Telescope 5.0 takes another small step in galactic space exploration,https://blogs.microsoft.com/ai/worldwide-telescope-5-0-takes-another-small-step-in-galactic-space-exploration/
"Here are David Rothschild’s data-powered predictions for 2014, from the Super Bowl to Hillary Clinton",https://blogs.microsoft.com/ai/here-are-david-rothschilds-data-powered-predictions-for-2014-from-the-super-bowl-to-hillary-clinton/
Nokia Transitions,https://blogs.microsoft.com/ai/nokia-transitions/
"Bing Maps Preview app combines immersive, 3D imagery with information at your fingertips",https://blogs.microsoft.com/ai/bing-maps-preview-app-combines-immersive-3d-imagery-with-information-at-your-fingertips/
Join the conversation about art and technology in this ‘Instance’ of found images and 3D scans,https://blogs.microsoft.com/ai/join-the-conversation-about-art-and-technology-in-this-instance-of-found-images-and-3d-scans/
ChronoZoom is teaming up with teachers to rewrite history,https://blogs.microsoft.com/ai/chronozoom-is-teaming-up-with-teachers-to-rewrite-history/
Meet Microsoft’s master of high-tech showmanship,https://blogs.microsoft.com/ai/meet-microsofts-master-of-high-tech-showmanship/
WIRED prototypes four world-changing product ideas from Bill Gates,https://blogs.microsoft.com/ai/wired-prototypes-four-world-changing-product-ideas-from-bill-gates/
A busy week for Windows apps,https://blogs.microsoft.com/ai/a-busy-week-for-windows-apps/
Nokia gives us something to look forward to,https://blogs.microsoft.com/ai/nokia-gives-us-something-to-look-forward-to/
Meet Microsoft researcher Eric Horvitz’s disarmingly human AI personal assistant,https://blogs.microsoft.com/ai/meet-microsoft-researcher-eric-horvitzs-disarmingly-human-ai-personal-assistant/
Microsoft CityNext transforms the ‘digital architecture’ of residents’ everyday lives,https://blogs.microsoft.com/ai/microsoft-citynext-transforms-the-digital-architecture-of-residents-everyday-lives/
Get an exclusive look inside Microsoft’s new high-tech headquarters for the fight against cybercrime,https://blogs.microsoft.com/ai/get-an-exclusive-look-inside-microsofts-new-high-tech-headquarters-for-the-fight-against-cybercrime/
Nokia Copter takes flight,https://blogs.microsoft.com/ai/nokia-copter-takes-flight/
"The ChronoZoom challenge: Visualize history and compete for $5,000 and a trip to Moscow",https://blogs.microsoft.com/ai/the-chronozoom-challenge-visualize-history-and-compete-for-5000-and-a-trip-to-moscow/
Video: Nokia Shows off the Lumia 2520,https://blogs.microsoft.com/ai/video-nokia-shows-off-the-lumia-2520/
Video: Witness Surface 2’s impressive display,https://blogs.microsoft.com/ai/video-witness-surface-2s-impressive-display/
Video: Get to know Surface 2’s clever two-position kickstand,https://blogs.microsoft.com/ai/video-get-to-know-surface-2s-clever-two-position-kickstand/
Video: Designing and engineering the Surface 2,https://blogs.microsoft.com/ai/video-designing-and-engineering-the-surface-2/
Sign language translator uses Kinect as a bridge between the deaf and hearing,https://blogs.microsoft.com/ai/sign-language-translator-uses-kinect-as-a-bridge-between-the-deaf-and-hearing/
Microsoft launches new /People profiles site,https://blogs.microsoft.com/ai/microsoft-launches-new-people-profiles-site/
Here’s a story for you…,https://blogs.microsoft.com/ai/heres-a-story-for-you/
Video: See how this doctor uses Surface Pro to deliver better care to his patients,https://blogs.microsoft.com/ai/video-see-how-this-doctor-uses-surface-pro-to-deliver-better-care-to-his-patients/
Deadmau5 got a Microsoft PPI screen,https://blogs.microsoft.com/ai/deadmau5-got-a-microsoft-ppi-screen/
Video: Take a closer look at the Surface Touch Cover 2,https://blogs.microsoft.com/ai/video-take-a-closer-look-at-the-surface-touch-cover-2/
My new favorite Microsoft advert,https://blogs.microsoft.com/ai/my-new-favorite-microsoft-advert/
Meet the researcher who took Xbox One’s audio performance to the next level,https://blogs.microsoft.com/ai/meet-the-researcher-who-took-xbox-ones-audio-performance-to-the-next-level/
The monster on my desktop,https://blogs.microsoft.com/ai/the-monster-on-my-desktop/
Art Center dreams of new Surface blades,https://blogs.microsoft.com/ai/art-center-dreams-of-new-surface-blades/
This urban art installation is powered by Windows,https://blogs.microsoft.com/ai/this-urban-art-installation-is-powered-by-windows/
Microsoft goes analog with Little Printer,https://blogs.microsoft.com/ai/microsoft-goes-analog-with-little-printer/
On the road with Surface 2,https://blogs.microsoft.com/ai/on-the-road-with-surface-2/
The making of Xbox One’s powerful new time-of-flight sensing camera,https://blogs.microsoft.com/ai/the-making-of-xbox-ones-powerful-new-time-of-flight-sensing-camera/
Translation tech powers automatic subtitles for everyday life,https://blogs.microsoft.com/ai/translation-tech-powers-automatic-subtitles-for-everyday-life/
The future is already here…,https://blogs.microsoft.com/ai/the-future-is-already-here/
NY 41X41 short movie shot on the Lumia 1020,https://blogs.microsoft.com/ai/ny-41x41-short-movie-shot-on-the-lumia-1020/
Microsoft displays its cred at Maker Faire New York,https://blogs.microsoft.com/ai/microsoft-displays-its-cred-at-maker-faire-new-york/
Exclusive: talking Surface with Microsoft’s Panos Panay,https://blogs.microsoft.com/ai/exclusive-talking-surface-with-microsofts-panos-panay/
A whole new Surface,https://blogs.microsoft.com/ai/a-whole-new-surface/
Microsoft back at New York Fashion Week,https://blogs.microsoft.com/ai/microsoft-back-at-new-york-fashion-week/
What’s a Forza Motorsport zoetrope?,https://blogs.microsoft.com/ai/whats-a-forza-motorsport-zoetrope/
See what’s new in Kinect for Windows SDK 1.8,https://blogs.microsoft.com/ai/see-whats-new-in-kinect-for-windows-sdk-1-8/
Skype: The story of an Estonian startup and a jellyfish drink,https://blogs.microsoft.com/ai/skype-the-story-of-an-estonian-startup-and-a-jellyfish-drink/
The Lumia 1020: changing my perceptions,https://blogs.microsoft.com/ai/the-lumia-1020-changing-my-perceptions/
Nine Inch Nails takes Kinect on tour,https://blogs.microsoft.com/ai/nine-inch-nails-takes-kinect-on-tour/
A Q&A with Ubi Interactive,https://blogs.microsoft.com/ai/a-qa-with-ubi-interactive/
Do keyboards have a future in a touch- and speech-enabled world?,https://blogs.microsoft.com/ai/do-keyboards-have-a-future-in-a-touch-and-speech-enabled-world/
Microsoft intern makes a water cooler that flirts with you,https://blogs.microsoft.com/ai/microsoft-intern-makes-a-water-cooler-that-flirts-with-you/
How Bing-powered optical character recognition is enhancing your SkyDrive experience,https://blogs.microsoft.com/ai/how-bing-powered-optical-character-recognition-is-enhancing-your-skydrive-experience/
Foursquare app arrives on Windows 8,https://blogs.microsoft.com/ai/foursquare-app-arrives-on-windows-8/
An upgrade to the lowly ruler,https://blogs.microsoft.com/ai/an-upgrade-to-the-lowly-ruler/
InfraStructs lets you embed info in 3D printed objects,https://blogs.microsoft.com/ai/infrastructs-lets-you-embed-info-in-3d-printed-objects/
Create your own gaming universe with ‘Project Spark’,https://blogs.microsoft.com/ai/create-your-own-gaming-universe-with-project-spark/
LEGOS: play toy or learning tool?,https://blogs.microsoft.com/ai/legos-play-toy-or-learning-tool/
Start your engines with the new OnStar RemoteLink app for Windows Phone,https://blogs.microsoft.com/ai/start-your-engines-with-the-new-onstar-remotelink-app-for-windows-phone/
One Shot on World Photography Day,https://blogs.microsoft.com/ai/one-shot-on-world-photography-day/
Talking Microsoft on Monocle,https://blogs.microsoft.com/ai/talking-microsoft-on-monocle/
Microsoft’s Bill Buxton on the next frontier of experience design,https://blogs.microsoft.com/ai/microsofts-bill-buxton-on-the-next-frontier-of-experience-design/
Microsoft by the Numbers,https://blogs.microsoft.com/ai/microsoft-by-the-numbers/
A head-turning blend of high fashion and high tech,https://blogs.microsoft.com/ai/a-head-turning-blend-of-high-fashion-and-high-tech/
Bing apps are now on Windows Phone 8,https://blogs.microsoft.com/ai/bing-apps-are-now-on-windows-phone-8/
Dassault and Kinect delivering a new art form,https://blogs.microsoft.com/ai/dassault-and-kinect-delivering-a-new-art-form/
500px photography now featured on Bing,https://blogs.microsoft.com/ai/500px-photography-now-featured-on-bing/
"Nokia JobLens app uses social, augmented reality to help you find your next gig",https://blogs.microsoft.com/ai/nokia-joblens-app-uses-social-augmented-reality-to-help-you-find-your-next-gig/
"Digital artist, 97, makes masterpieces with vintage Microsoft Paint",https://blogs.microsoft.com/ai/digital-artist-97-makes-masterpieces-with-vintage-microsoft-paint/
SkyDrive & friends,https://blogs.microsoft.com/ai/skydrive-friends/
PSFK: The Future of Home Living,https://blogs.microsoft.com/ai/psfk-the-future-of-home-living/
3D printing in Windows 8.1 is as easy as printing a Word doc,https://blogs.microsoft.com/ai/3d-printing-in-windows-8-1-is-as-easy-as-printing-a-word-doc/
Microsoft’s innovators,https://blogs.microsoft.com/ai/microsofts-innovators/
Deadmau5 wears Microsoft,https://blogs.microsoft.com/ai/deadmau5-wears-microsoft/
Modern art for the masses: A look at the new Fresh Paint,https://blogs.microsoft.com/ai/modern-art-for-the-masses-a-look-at-the-new-fresh-paint/
Nokia Lumia 1020 ultimate accessory,https://blogs.microsoft.com/ai/nokia-lumia-1020-ultimate-accessory/
Q&A with Clay Shirky,https://blogs.microsoft.com/ai/qa-with-clay-shirky/
Four reasons to download the Microsoft Research Video Library app,https://blogs.microsoft.com/ai/four-reasons-to-download-the-microsoft-research-video-library-app/
New interactive graphics research at SIGGRAPH 2013,https://blogs.microsoft.com/ai/new-interactive-graphics-research-at-siggraph-2013/
The Lab of Things,https://blogs.microsoft.com/ai/the-lab-of-things/
What’s cooking in Redmond,https://blogs.microsoft.com/ai/whats-cooking-in-redmond/
Microsoft Research Faculty Summit 2013,https://blogs.microsoft.com/ai/microsoft-research-faculty-summit-2013/
Imagine Cup 2013 Winners,https://blogs.microsoft.com/ai/imagine-cup-2013-winners/
"CityNext: Imagining a new world with big data, smarter citizens, and better cities",https://blogs.microsoft.com/ai/citynext-imagining-a-new-world-with-big-data-smarter-citizens-and-better-cities/
Test your internet connection speed with these apps from Microsoft Research,https://blogs.microsoft.com/ai/test-your-internet-connection-speed-with-these-apps-from-microsoft-research/
Worldwide Partner Conference 2013,https://blogs.microsoft.com/ai/worldwide-partner-conference-2013/
KTLA goes behind the scenes at Microsoft,https://blogs.microsoft.com/ai/ktla-goes-behind-the-scenes-at-microsoft/
Design by Massimo Vignelli,https://blogs.microsoft.com/ai/design-by-massimo-vignelli/
Foodie heaven in the Windows Store,https://blogs.microsoft.com/ai/foodie-heaven-in-the-windows-store/
GeekWire app for Windows Phone,https://blogs.microsoft.com/ai/geekwire-app-for-windows-phone/
Flipboard is coming to Windows at just the right time,https://blogs.microsoft.com/ai/flipboard-is-coming-to-windows-at-just-the-right-time/
A directional sign that comes alive,https://blogs.microsoft.com/ai/a-directional-sign-that-comes-alive/
3D printing in Windows 8.1,https://blogs.microsoft.com/ai/3d-printing-in-windows-8-1/
New ad prototypes take creative potential of Microsoft’s platforms to the next level,https://blogs.microsoft.com/ai/new-ad-prototypes-take-creative-potential-of-microsofts-platforms-to-the-next-level/
"Inside this anechoic chamber, researchers study the sounds of silence",https://blogs.microsoft.com/ai/inside-this-anechoic-chamber-researchers-study-the-sounds-of-silence/
Oscar winner Randy Thom on sound design,https://blogs.microsoft.com/ai/oscar-winner-randy-thom-on-sound-design/
Building Xbox One,https://blogs.microsoft.com/ai/building-xbox-one/
The lowly battery gets a make-over,https://blogs.microsoft.com/ai/the-lowly-battery-gets-a-make-over/
Where Creativity Meets: Microsoft Research Celebrates the Creator in You,https://blogs.microsoft.com/ai/where-creativity-meets-microsoft-research-celebrates-the-creator-in-you/
How deep neural networks technology taught Windows Phone to understand you better,https://blogs.microsoft.com/ai/how-deep-neural-networks-technology-taught-windows-phone-to-understand-you-better/
Forza Motorsport 5 is coming,https://blogs.microsoft.com/ai/forza-motorsport-5-is-coming/
Windows Everywhere,https://blogs.microsoft.com/ai/windows-everywhere/
Microsoft’s eBook Predictions From 1999,https://blogs.microsoft.com/ai/microsofts-ebook-predictions-from-1999/
See three cool new Kinect for Windows apps from nsquared,https://blogs.microsoft.com/ai/see-three-cool-new-kinect-for-windows-apps-from-nsquared/
"Redefining the ""mobile"" app development platform",https://blogs.microsoft.com/ai/redefining-the-mobile-app-development-platform/
The design revolution at Microsoft is anything but flat,https://blogs.microsoft.com/ai/the-design-revolution-at-microsoft-is-anything-but-flat/
Bing Translator app now available on Windows 8,https://blogs.microsoft.com/ai/bing-translator-app-now-available-on-windows-8/
First look at Windows 8.1,https://blogs.microsoft.com/ai/first-look-at-windows-8-1/
Gravilux app for Windows 8: A complimentary moment of cosmic calm,https://blogs.microsoft.com/ai/gravilux-app-for-windows-8-a-complimentary-moment-of-cosmic-calm/
Meet Microsoft’s innovators at WPC 2013,https://blogs.microsoft.com/ai/meet-microsofts-innovators-at-wpc-2013/
BBC iPlayer on Windows Phone 8,https://blogs.microsoft.com/ai/bbc-iplayer-on-windows-phone-8/
The labs behind Xbox One,https://blogs.microsoft.com/ai/the-labs-behind-xbox-one/
Forza Motorsport 5 revs up for Xbox One launch,https://blogs.microsoft.com/ai/forza-motorsport-5-revs-up-for-xbox-one-launch/
Say hello to the powerful new Kinect for Windows sensor,https://blogs.microsoft.com/ai/say-hello-to-the-powerful-new-kinect-for-windows-sensor/
Make Way for the Programmable World,https://blogs.microsoft.com/ai/make-way-for-the-programmable-world/
Xbox One Anthem video,https://blogs.microsoft.com/ai/xbox-one-anthem-video/
VIDEO: Xbox One revealed,https://blogs.microsoft.com/ai/video-xbox-one-revealed/
Geek 2 Chic,https://blogs.microsoft.com/ai/geek-2-chic/
Imagining Surface,https://blogs.microsoft.com/ai/imagining-surface/
GoPro app arrives for Windows Phone,https://blogs.microsoft.com/ai/gopro-app-arrives-for-windows-phone/
Taking a Slow Approach to Technology,https://blogs.microsoft.com/ai/taking-a-slow-approach-to-technology/
Nokia Lumia 925 #want,https://blogs.microsoft.com/ai/nokia-lumia-925-want/
Microsoft’s best designers in technology,https://blogs.microsoft.com/ai/microsofts-best-designers-in-technology/
Microsoft Research meets Hollywood,https://blogs.microsoft.com/ai/microsoft-research-meets-hollywood/
Keeping Cars Safe with Glanceable Design,https://blogs.microsoft.com/ai/keeping-cars-safe-with-glanceable-design/
Designing the Future Driving Experience,https://blogs.microsoft.com/ai/designing-the-future-driving-experience/
Engineering the Car of the Future,https://blogs.microsoft.com/ai/engineering-the-car-of-the-future/
Microsoft launches The Fire Hose blog,https://blogs.microsoft.com/ai/microsoft-launches-the-fire-hose-blog/
Meet Windows Embedded Automotive,https://blogs.microsoft.com/ai/meet-windows-embedded-automotive/
Lomogram for Windows Phone 8,https://blogs.microsoft.com/ai/lomogram-for-windows-phone-8/
The Future of Touch,https://blogs.microsoft.com/ai/the-future-of-touch/
Mother Earth Motherboard,https://blogs.microsoft.com/ai/mother-earth-motherboard/
Windows Store shows devices and services,https://blogs.microsoft.com/ai/windows-store-shows-devices-and-services/
Microsoft at the Creativity Conference,https://blogs.microsoft.com/ai/microsoft-at-the-creativity-conference/
Latest Kinect projects include Holographic Princess Leia,https://blogs.microsoft.com/ai/latest-kinect-projects-include-holographic-princess-leia/
Conserving Wildlife with Data,https://blogs.microsoft.com/ai/conserving-wildlife-with-data/
Room-sized Computing on a Budget,https://blogs.microsoft.com/ai/room-sized-computing-on-a-budget/
Little Details: SkyDrive gets nicely overprotective,https://blogs.microsoft.com/ai/little-details-skydrive-gets-nicely-overprotective/
A new stage for Microsoft storytelling,https://blogs.microsoft.com/ai/a-new-stage-for-microsoft-storytelling/
Project GeoFlow: A New Dimension in Viewing Geospatial and Temporal Data,https://blogs.microsoft.com/ai/project-geoflow-a-new-dimension-in-viewing-geospatial-and-temporal-data/
A Kinect powered virtual dressing room on TODAY Show,https://blogs.microsoft.com/ai/a-kinect-powered-virtual-dressing-room-on-today-show/
Hidden Gems: Microsoft’s Worldwide Telescope,https://blogs.microsoft.com/ai/hidden-gems-microsofts-worldwide-telescope/
Things We’ve Learnt About Search,https://blogs.microsoft.com/ai/things-weve-learnt-about-search/
London calling,https://blogs.microsoft.com/ai/london-calling/
Nike slam dunks with Kinect at Selfridges,https://blogs.microsoft.com/ai/nike-slam-dunks-with-kinect-at-selfridges/
Building Microsoft’s Campus Experience app,https://blogs.microsoft.com/ai/building-microsofts-campus-experience-app/
Microsoft’s Underground Tour 2013,https://blogs.microsoft.com/ai/microsofts-underground-tour-2013/
Creating Transparent Device Experiences,https://blogs.microsoft.com/ai/creating-transparent-device-experiences/
A virtual choir with Skype,https://blogs.microsoft.com/ai/a-virtual-choir-with-skype/
Aviary brings their photo editing platform,https://blogs.microsoft.com/ai/aviary-brings-their-photo-editing-platform/
Surface Xbox Avatar Prop,https://blogs.microsoft.com/ai/surface-xbox-avatar-prop/
Reimagining the Phone Booth of the Future,https://blogs.microsoft.com/ai/reimagining-the-phone-booth-of-the-future/
The role of designers in a connected world,https://blogs.microsoft.com/ai/the-role-of-designers-in-a-connected-world/
No More Missing Attachments in Outlook,https://blogs.microsoft.com/ai/no-more-missing-attachments-in-outlook/
Kinect for Windows SDK hits 1.7 and brings Kinect Fusion,https://blogs.microsoft.com/ai/kinect-for-windows-sdk-hits-1-7-and-brings-kinect-fusion/
The Graphene-Based Super Capacitor,https://blogs.microsoft.com/ai/the-graphene-based-super-capacitor/
Twitter for Windows 8,https://blogs.microsoft.com/ai/twitter-for-windows-8/
Craftsmanship,https://blogs.microsoft.com/ai/craftsmanship/
Boards of keys at Microsoft,https://blogs.microsoft.com/ai/boards-of-keys-at-microsoft/
In-flight Entertainment without the Wires,https://blogs.microsoft.com/ai/in-flight-entertainment-without-the-wires/
Right Now at Microsoft,https://blogs.microsoft.com/ai/right-now-at-microsoft/
Microsoft Research: predicting weather patterns and forest fires,https://blogs.microsoft.com/ai/microsoft-research-predicting-weather-patterns-and-forest-fires/
Microsoft TechFest 2013: 3-D Display with Haptic Feedback,https://blogs.microsoft.com/ai/microsoft-techfest-2013-3-d-display-with-haptic-feedback/
Microsoft TechFest 2013: SketchInsight,https://blogs.microsoft.com/ai/microsoft-techfest-2013-sketchinsight/
Microsoft TechForum: A New World of Intelligent Technology,https://blogs.microsoft.com/ai/microsoft-techforum-a-new-world-of-intelligent-technology/
Step inside the Microsoft Envisioning Center,https://blogs.microsoft.com/ai/step-inside-the-microsoft-envisioning-center/
Bringing Life to a Department Store Mannequin,https://blogs.microsoft.com/ai/bringing-life-to-a-department-store-mannequin/
Developing for Internet Explorer for Xbox,https://blogs.microsoft.com/ai/developing-for-internet-explorer-for-xbox/
Code can change the world,https://blogs.microsoft.com/ai/code-can-change-the-world/
Conferences badges go NFC,https://blogs.microsoft.com/ai/conferences-badges-go-nfc/
The International Women’s Hackathon,https://blogs.microsoft.com/ai/the-international-womens-hackathon/
Reading the Tea Leaves of Unstructured Data,https://blogs.microsoft.com/ai/reading-the-tea-leaves-of-unstructured-data/
Windows in your hotel room,https://blogs.microsoft.com/ai/windows-in-your-hotel-room/
Big Data: Making “Magical” Things Possible,https://blogs.microsoft.com/ai/big-data-making-magical-things-possible/
Miss Underwood’s Printing Dress “Knockoff”,https://blogs.microsoft.com/ai/miss-underwoods-printing-dress-knockoff/
Imagine Cup 2013,https://blogs.microsoft.com/ai/imagine-cup-2013/
A More Intelligent Approach to Car Sharing,https://blogs.microsoft.com/ai/a-more-intelligent-approach-to-car-sharing/
Contre Jour Explores New Worlds,https://blogs.microsoft.com/ai/contre-jour-explores-new-worlds/
Roll your own weather forecast with Big Data and cloud computing,https://blogs.microsoft.com/ai/roll-your-own-weather-forecast-with-big-data-and-cloud-computing/
The Hearst Fashion Hack,https://blogs.microsoft.com/ai/the-hearst-fashion-hack/
The Surface Blog,https://blogs.microsoft.com/ai/the-surface-blog/
How the Bing Apps for Windows 8 were built,https://blogs.microsoft.com/ai/how-the-bing-apps-for-windows-8-were-built/
Bringing the Internet to Rural Kenya,https://blogs.microsoft.com/ai/bringing-the-internet-to-rural-kenya/
Great Apps for Windows Phone 8,https://blogs.microsoft.com/ai/great-apps-for-windows-phone-8/
BLINK from Microsoft Research gets you the perfect Windows Phone photo,https://blogs.microsoft.com/ai/blink-from-microsoft-research-gets-you-the-perfect-windows-phone-photo/
Machine Learning on Windows Phone 8,https://blogs.microsoft.com/ai/machine-learning-on-windows-phone-8/
Social Computing Symposium 2013,https://blogs.microsoft.com/ai/social-computing-symposium-2013/
City Lens 2.0,https://blogs.microsoft.com/ai/city-lens-2-0/
Office 365,https://blogs.microsoft.com/ai/office-365/
2013: The Year of the “Alchemic Cloud”,https://blogs.microsoft.com/ai/2013-the-year-of-the-alchemic-cloud/
Ford Goes Further with Big Data and Machine Learning,https://blogs.microsoft.com/ai/ford-goes-further-with-big-data-and-machine-learning/
Ben the PC Guy: What’s in my bag?,https://blogs.microsoft.com/ai/ben-the-pc-guy-whats-in-my-bag/
Telepresence: Coming to an Office Near You,https://blogs.microsoft.com/ai/telepresence-coming-to-an-office-near-you/
Are You a Child of the 90’s?,https://blogs.microsoft.com/ai/are-you-a-child-of-the-90s/
