Nokia 3-D Printing Challenge,https://blogs.microsoft.com/ai/nokia-3-d-printing-challenge/
Surface with Windows 8 Pro: Available February 9th,https://blogs.microsoft.com/ai/surface-with-windows-8-pro-available-february-9th/
Interaction Design and the Internet of Things,https://blogs.microsoft.com/ai/interaction-design-and-the-internet-of-things/
Little Details: Windows Phone photorealistic icons,https://blogs.microsoft.com/ai/little-details-windows-phone-photorealistic-icons/
CES trip report,https://blogs.microsoft.com/ai/ces-trip-report/
Microsoft HelpBridge,https://blogs.microsoft.com/ai/microsoft-helpbridge/
Razorfish Takes Shopping Trips to the Next Dimension,https://blogs.microsoft.com/ai/razorfish-takes-shopping-trips-to-the-next-dimension/
A Hardware Junkie’s Paradise,https://blogs.microsoft.com/ai/a-hardware-junkies-paradise/
NRF 2013: Reshaping the Shopping Experience,https://blogs.microsoft.com/ai/nrf-2013-reshaping-the-shopping-experience/
A sentiment analysis app hits the Windows Store,https://blogs.microsoft.com/ai/a-sentiment-analysis-app-hits-the-windows-store/
Natural User Interfaces Part 4: What’s Next?,https://blogs.microsoft.com/ai/natural-user-interfaces-part-4-whats-next/
Microsoft Research at CES: IllumiRoom,https://blogs.microsoft.com/ai/microsoft-research-at-ces-illumiroom/
Natural User Interfaces Part 3: The Kinect Effect,https://blogs.microsoft.com/ai/natural-user-interfaces-part-3-the-kinect-effect/
Natural User Interfaces Part 2: Kinect at work,https://blogs.microsoft.com/ai/natural-user-interfaces-part-2-kinect-at-work/
Weather Flow for Windows Phone 8,https://blogs.microsoft.com/ai/weather-flow-for-windows-phone-8/
Natural User Interfaces Part 1: a primer,https://blogs.microsoft.com/ai/natural-user-interfaces-part-1-a-primer/
Bing on Windows Phone 8,https://blogs.microsoft.com/ai/bing-on-windows-phone-8/
A career in technology at Microsoft,https://blogs.microsoft.com/ai/a-career-in-technology-at-microsoft/
January on Next at Microsoft,https://blogs.microsoft.com/ai/january-on-next-at-microsoft/
Urbanspoon on Windows Phone 8,https://blogs.microsoft.com/ai/urbanspoon-on-windows-phone-8/
Talking trends on GeekWire,https://blogs.microsoft.com/ai/talking-trends-on-geekwire/
Little Printer: Where digital and analog live in beautiful harmony,https://blogs.microsoft.com/ai/little-printer-where-digital-and-analog-live-in-beautiful-harmony/
Forza Horizon January Recaro Car Pack,https://blogs.microsoft.com/ai/forza-horizon-january-recaro-car-pack/
The Internet of Things under the Christmas tree,https://blogs.microsoft.com/ai/the-internet-of-things-under-the-christmas-tree/
Getting my Surface groove on,https://blogs.microsoft.com/ai/getting-my-surface-groove-on/
I’m spending Christmas mostly sideways,https://blogs.microsoft.com/ai/im-spending-christmas-mostly-sideways/
A look at Microsoft’s 2012 through YouTube,https://blogs.microsoft.com/ai/a-look-at-microsofts-2012-through-youtube/
A small demonstration of Windows 8,https://blogs.microsoft.com/ai/a-small-demonstration-of-windows-8/
The Environment Art of Halo 4,https://blogs.microsoft.com/ai/the-environment-art-of-halo-4/
Tracking Santa with NORAD on Windows 8 and Windows Phone,https://blogs.microsoft.com/ai/tracking-santa-with-norad-on-windows-8-and-windows-phone/
Hardware optimized for Windows 8,https://blogs.microsoft.com/ai/hardware-optimized-for-windows-8/
2012: A Year of Microsoft Milestones,https://blogs.microsoft.com/ai/2012-a-year-of-microsoft-milestones/
Photographs around Microsoft #18,https://blogs.microsoft.com/ai/photographs-around-microsoft-18/
Microsoft’s Garage + Startup Weekend = 3 Days to Launch a startup,https://blogs.microsoft.com/ai/microsofts-garage-startup-weekend-3-days-to-launch-a-startup/
Atari Arcade on Windows Phone,https://blogs.microsoft.com/ai/atari-arcade-on-windows-phone/
Nokia Cinemagraph brings animated GIF creation to the Lumia,https://blogs.microsoft.com/ai/nokia-cinemagraph-brings-animated-gif-creation-to-the-lumia/
The Economist arrives on Windows 8,https://blogs.microsoft.com/ai/the-economist-arrives-on-windows-8/
VIDEO: The story behind Bing home page images,https://blogs.microsoft.com/ai/video-the-story-behind-bing-home-page-images/
Alex Kipman – IPO Inventor of the Year,https://blogs.microsoft.com/ai/alex-kipman-ipo-inventor-of-the-year/
SkyDrive lands on Xbox 360,https://blogs.microsoft.com/ai/skydrive-lands-on-xbox-360/
NikeFuel Station uses Kinect,https://blogs.microsoft.com/ai/nikefuel-station-uses-kinect/
Photographs around Microsoft #17,https://blogs.microsoft.com/ai/photographs-around-microsoft-17/
Next at Microsoft – Windows 8 app launched,https://blogs.microsoft.com/ai/next-at-microsoft-windows-8-app-launched/
Forza Horizon – December IGN Car Pack,https://blogs.microsoft.com/ai/forza-horizon-december-ign-car-pack/
Samsung Printer Experience on Windows 8,https://blogs.microsoft.com/ai/samsung-printer-experience-on-windows-8/
Nokia Lumia 620,https://blogs.microsoft.com/ai/nokia-lumia-620/
Little Details: Bing,https://blogs.microsoft.com/ai/little-details-bing/
Imagine Cup Awards Grants for Creative Tech Solutions,https://blogs.microsoft.com/ai/imagine-cup-awards-grants-for-creative-tech-solutions/
MSR India Puts a Finger On a Solution to the Tuberculosis Epidemic,https://blogs.microsoft.com/ai/msr-india-puts-a-finger-on-a-solution-to-the-tuberculosis-epidemic/
Amazon app for Windows 8,https://blogs.microsoft.com/ai/amazon-app-for-windows-8/
Photographs around Microsoft #16,https://blogs.microsoft.com/ai/photographs-around-microsoft-16/
Lenovo IdeaPad Yoga 13,https://blogs.microsoft.com/ai/lenovo-ideapad-yoga-13/
"Craig Mundie’s TechForum Insights: Episode 1, Big Data and Machine Learning",https://blogs.microsoft.com/ai/craig-mundies-techforum-insights-episode-1-big-data-and-machine-learning/
unnamed soundsculpture: a beautiful Kinect project,https://blogs.microsoft.com/ai/unnamed-soundsculpture-a-beautiful-kinect-project/
Polyglots “R” Us: Bing Translator app hits Windows Phone 8,https://blogs.microsoft.com/ai/polyglots-r-us-bing-translator-app-hits-windows-phone-8/
Bumble goes speed dating with Windows Phone,https://blogs.microsoft.com/ai/bumble-goes-speed-dating-with-windows-phone/
Nokia LiveSight: A New Definition to World Atlas,https://blogs.microsoft.com/ai/nokia-livesight-a-new-definition-to-world-atlas/
Microsoft 2012 Holiday Look Book,https://blogs.microsoft.com/ai/microsoft-2012-holiday-look-book/
Photographs around Microsoft #15,https://blogs.microsoft.com/ai/photographs-around-microsoft-15/
Supercomputing on Demand with Windows Azure,https://blogs.microsoft.com/ai/supercomputing-on-demand-with-windows-azure/
Kinect for Windows Puts Patients at Ease,https://blogs.microsoft.com/ai/kinect-for-windows-puts-patients-at-ease/
"Dr. Jeannette Wing: New Vice President, Head of Microsoft Research International",https://blogs.microsoft.com/ai/dr-jeannette-wing-new-vice-president-head-of-microsoft-research-international/
"Sonos, The xx and Kinect create a musical immersion",https://blogs.microsoft.com/ai/sonos-the-xx-and-kinect-create-a-musical-immersion/
Xbox takes center stage in the devices and services world,https://blogs.microsoft.com/ai/xbox-takes-center-stage-in-the-devices-and-services-world/
Photographs around Microsoft #14,https://blogs.microsoft.com/ai/photographs-around-microsoft-14/
Free panoramic themes for Windows 8 and Windows RT,https://blogs.microsoft.com/ai/free-panoramic-themes-for-windows-8-and-windows-rt/
Behind the scenes of Fresh Paint on Windows 8,https://blogs.microsoft.com/ai/behind-the-scenes-of-fresh-paint-on-windows-8/
Craig Mundie: How Tomorrow’s Technologies Will Shape Your World,https://blogs.microsoft.com/ai/craig-mundie-how-tomorrows-technologies-will-shape-your-world/
Gwen Stefani’s phone,https://blogs.microsoft.com/ai/gwen-stefanis-phone/
Windows 8 cover photo creator for Facebook,https://blogs.microsoft.com/ai/windows-8-cover-photo-creator-for-facebook/
Microsoft.com gets RWD,https://blogs.microsoft.com/ai/microsoft-com-gets-rwd/
Imagine Cup winner on Time magazine’s best inventions of 2012 list,https://blogs.microsoft.com/ai/imagine-cup-winner-on-time-magazines-best-inventions-of-2012-list/
Skype for Windows Phone 8 preview now available,https://blogs.microsoft.com/ai/skype-for-windows-phone-8-preview-now-available/
Little Details: Windows 8 passwords,https://blogs.microsoft.com/ai/little-details-windows-8-passwords/
Is There Much Of A Market For A Universal Translator?,https://blogs.microsoft.com/ai/is-there-much-of-a-market-for-a-universal-translator/
Windows 8: May The Birds Be With You..,https://blogs.microsoft.com/ai/windows-8-may-the-birds-be-with-you/
Photographs around Microsoft #13,https://blogs.microsoft.com/ai/photographs-around-microsoft-13/
Forza Horizon Bondurant Car Pack,https://blogs.microsoft.com/ai/forza-horizon-bondurant-car-pack/
Yammer: All Your Business Apps. One Social Experience.,https://blogs.microsoft.com/ai/yammer-all-your-business-apps-one-social-experience/
Composite art on Windows Phone,https://blogs.microsoft.com/ai/composite-art-on-windows-phone/
Bing homepage becomes downloadable,https://blogs.microsoft.com/ai/bing-homepage-becomes-downloadable/
Microsoft Research shows a promising new breakthrough in speech translation technology,https://blogs.microsoft.com/ai/microsoft-research-shows-a-promising-new-breakthrough-in-speech-translation-technology/
Xbox SmartGlass now available for iOS devices,https://blogs.microsoft.com/ai/xbox-smartglass-now-available-for-ios-devices/
Halo 4 in the clouds,https://blogs.microsoft.com/ai/halo-4-in-the-clouds/
Drop testing a Surface from a moving vehicle,https://blogs.microsoft.com/ai/drop-testing-a-surface-from-a-moving-vehicle/
Khan Academy is in the Windows Store,https://blogs.microsoft.com/ai/khan-academy-is-in-the-windows-store/
Kinect Fusion is coming to the SDK,https://blogs.microsoft.com/ai/kinect-fusion-is-coming-to-the-sdk/
Nike+ Kinect Training: This is not a game,https://blogs.microsoft.com/ai/nike-kinect-training-this-is-not-a-game/
Forza Horizon and Xbox SmartGlass,https://blogs.microsoft.com/ai/forza-horizon-and-xbox-smartglass/
Nextgen Reader hits the Windows Store,https://blogs.microsoft.com/ai/nextgen-reader-hits-the-windows-store/
SkyDrive images now in tweets,https://blogs.microsoft.com/ai/skydrive-images-now-in-tweets/
Talking NUI at the Seattle Interactive Conference 2012,https://blogs.microsoft.com/ai/talking-nui-at-the-seattle-interactive-conference-2012/
"The reimagining at Microsoft continues, this time with CRM",https://blogs.microsoft.com/ai/the-reimagining-at-microsoft-continues-this-time-with-crm/
Bing Halloween,https://blogs.microsoft.com/ai/bing-halloween/
Tools of the Modern Day Mapmaker,https://blogs.microsoft.com/ai/tools-of-the-modern-day-mapmaker/
Little Details: YouTube logos,https://blogs.microsoft.com/ai/little-details-youtube-logos/
What’s on Steve Ballmer’s Windows Phone?,https://blogs.microsoft.com/ai/whats-on-steve-ballmers-windows-phone/
What’s new with Windows Phone 8,https://blogs.microsoft.com/ai/whats-new-with-windows-phone-8/
New Skype on Windows Phone 8,https://blogs.microsoft.com/ai/new-skype-on-windows-phone-8/
The Making of the Design of Surface,https://blogs.microsoft.com/ai/the-making-of-the-design-of-surface/
Microsoft Lync for Windows 8,https://blogs.microsoft.com/ai/microsoft-lync-for-windows-8/
360° degree panoramas on the Bing homepage,https://blogs.microsoft.com/ai/360-degree-panoramas-on-the-bing-homepage/
Times Square becomes Tiles Square,https://blogs.microsoft.com/ai/times-square-becomes-tiles-square/
Surface is here,https://blogs.microsoft.com/ai/surface-is-here/
Windows 8: The World is Ready,https://blogs.microsoft.com/ai/windows-8-the-world-is-ready/
Forza Horizon houses my dream garage,https://blogs.microsoft.com/ai/forza-horizon-houses-my-dream-garage/
The Making of Touch Cover for Surface,https://blogs.microsoft.com/ai/the-making-of-touch-cover-for-surface/
The Windows 8 ads are here,https://blogs.microsoft.com/ai/the-windows-8-ads-are-here/
The Microtropolis is coming to New York City,https://blogs.microsoft.com/ai/the-microtropolis-is-coming-to-new-york-city/
Xbox SmartGlass arriving this week,https://blogs.microsoft.com/ai/xbox-smartglass-arriving-this-week/
Bill Gates on Surface,https://blogs.microsoft.com/ai/bill-gates-on-surface/
Skype for Windows 8,https://blogs.microsoft.com/ai/skype-for-windows-8/
"Exclusive video: Bill Gates on Windows 8, Windows Phone 8 and Surface",https://blogs.microsoft.com/ai/exclusive-video-bill-gates-on-windows-8-windows-phone-8-and-surface/
Richard Banks explains why people film on their phones at concerts,https://blogs.microsoft.com/ai/richard-banks-explains-why-people-film-on-their-phones-at-concerts/
Surface with Windows RT Drop Test,https://blogs.microsoft.com/ai/surface-with-windows-rt-drop-test/
Photographs around Microsoft #12,https://blogs.microsoft.com/ai/photographs-around-microsoft-12/
4th & Square on Windows 8,https://blogs.microsoft.com/ai/4th-square-on-windows-8/
"Some questions, and answers, about Surface",https://blogs.microsoft.com/ai/some-questions-and-answers-about-surface/
Surface website gets an update,https://blogs.microsoft.com/ai/surface-website-gets-an-update/
Learn more about Surface,https://blogs.microsoft.com/ai/learn-more-about-surface/
Microsoft Research aiding brain-tumor patients,https://blogs.microsoft.com/ai/microsoft-research-aiding-brain-tumor-patients/
Internet Explorer on Xbox 360. Hello familiar.,https://blogs.microsoft.com/ai/internet-explorer-on-xbox-360-hello-familiar/
The Making of Microsoft Surface,https://blogs.microsoft.com/ai/the-making-of-microsoft-surface/
The Surface movement,https://blogs.microsoft.com/ai/the-surface-movement/
Surface street art,https://blogs.microsoft.com/ai/surface-street-art/
Making art with Kinect,https://blogs.microsoft.com/ai/making-art-with-kinect/
"Xbox Music: all the music you love, every way you want it",https://blogs.microsoft.com/ai/xbox-music-all-the-music-you-love-every-way-you-want-it/
Some videos I like,https://blogs.microsoft.com/ai/some-videos-i-like/
Netflix on Windows 8,https://blogs.microsoft.com/ai/netflix-on-windows-8/
Forza Horizon – Behind the Scenes Episode 3,https://blogs.microsoft.com/ai/forza-horizon-behind-the-scenes-episode-3/
Cell: A Kinect art installation that mirrors your online persona,https://blogs.microsoft.com/ai/cell-a-kinect-art-installation-that-mirrors-your-online-persona/
Windows 8 on Lenovo’s Yoga,https://blogs.microsoft.com/ai/windows-8-on-lenovos-yoga/
L’Oreal takes to Xbox,https://blogs.microsoft.com/ai/loreal-takes-to-xbox/
The Interactive Artistry of Contre Jour comes to IE and Xbox Live,https://blogs.microsoft.com/ai/the-interactive-artistry-of-contre-jour-comes-to-ie-and-xbox-live/
Kinect for Windows lands in China and gets Windows 8 support,https://blogs.microsoft.com/ai/kinect-for-windows-lands-in-china-and-gets-windows-8-support/
Microsoft Research Digits: 3D vision wearable computing concept,https://blogs.microsoft.com/ai/microsoft-research-digits-3d-vision-wearable-computing-concept/
Forza Horizon Xbox LIVE demo arrives October 9,https://blogs.microsoft.com/ai/forza-horizon-xbox-live-demo-arrives-october-9/
Photographs around Microsoft #11,https://blogs.microsoft.com/ai/photographs-around-microsoft-11/
Windows 8 ads in apps,https://blogs.microsoft.com/ai/windows-8-ads-in-apps/
Halo 4 soundtrack remix contest,https://blogs.microsoft.com/ai/halo-4-soundtrack-remix-contest/
Kate Tsoukalas gets outside of the box,https://blogs.microsoft.com/ai/kate-tsoukalas-gets-outside-of-the-box/
Lili Cheng on building tomorrow,https://blogs.microsoft.com/ai/lili-cheng-on-building-tomorrow/
Microsoft at the Grace Hopper Celebration of Women in Computing,https://blogs.microsoft.com/ai/microsoft-at-the-grace-hopper-celebration-of-women-in-computing/
Photographs around Microsoft #10,https://blogs.microsoft.com/ai/photographs-around-microsoft-10/
Bing gets some Klout,https://blogs.microsoft.com/ai/bing-gets-some-klout/
Forza Horizon – Behind the Scenes Episode 2,https://blogs.microsoft.com/ai/forza-horizon-behind-the-scenes-episode-2/
Technology making an impact in the NFL,https://blogs.microsoft.com/ai/technology-making-an-impact-in-the-nfl/
Bloomberg arrives on Windows Phone with Nokia,https://blogs.microsoft.com/ai/bloomberg-arrives-on-windows-phone-with-nokia/
The Internet of Baseball,https://blogs.microsoft.com/ai/the-internet-of-baseball/
Kinect and the “world’s biggest shoe store”,https://blogs.microsoft.com/ai/kinect-and-the-worlds-biggest-shoe-store/
Little Details: Windows logo favicon,https://blogs.microsoft.com/ai/little-details-windows-logo-favicon/
On The Verge 009 with Microsoft Research,https://blogs.microsoft.com/ai/on-the-verge-009-with-microsoft-research/
Photographs around Microsoft #9,https://blogs.microsoft.com/ai/photographs-around-microsoft-9/
GLOBALedit launches a digital LightTable with Microsoft’s PixelSense technology,https://blogs.microsoft.com/ai/globaledit-launches-a-digital-lighttable-with-microsofts-pixelsense-technology/
Microsoft YouthSpark – creating opportunity for 300 Million Young People,https://blogs.microsoft.com/ai/microsoft-youthspark-creating-opportunity-for-300-million-young-people/
Microsoft Sculpt Comfort Keyboard brings a new look to your space bar,https://blogs.microsoft.com/ai/microsoft-sculpt-comfort-keyboard-brings-a-new-look-to-your-space-bar/
Windows Phone 8X and 8S by HTC,https://blogs.microsoft.com/ai/windows-phone-8x-and-8s-by-htc/
NYFW: Fashion + Tech Meetup with Style Coalition and Microsoft,https://blogs.microsoft.com/ai/nyfw-fashion-tech-meetup-with-style-coalition-and-microsoft/
Download the NUIVerse,https://blogs.microsoft.com/ai/download-the-nuiverse/
Nokia and Fatboy,https://blogs.microsoft.com/ai/nokia-and-fatboy/
Photographs around Microsoft #8,https://blogs.microsoft.com/ai/photographs-around-microsoft-8/
Forza Horizon – Behind the Scenes,https://blogs.microsoft.com/ai/forza-horizon-behind-the-scenes/
"Next stop London, Milan, Paris fashion week",https://blogs.microsoft.com/ai/next-stop-london-milan-paris-fashion-week/
Your move QVC,https://blogs.microsoft.com/ai/your-move-qvc/
Microsoft Trendwatching: Fashion and Technology,https://blogs.microsoft.com/ai/microsoft-trendwatching-fashion-and-technology/
The Bing blind taste test,https://blogs.microsoft.com/ai/the-bing-blind-taste-test/
Fashion’s Night out with The Printing Dress,https://blogs.microsoft.com/ai/fashions-night-out-with-the-printing-dress/
#switchtolumia,https://blogs.microsoft.com/ai/switchtolumia/
IE is streaming The xx around the world,https://blogs.microsoft.com/ai/ie-is-streaming-the-xx-around-the-world/
NY Fashion Week. What’s in my bag?,https://blogs.microsoft.com/ai/ny-fashion-week-whats-in-my-bag/
Kinect for Windows coming to China,https://blogs.microsoft.com/ai/kinect-for-windows-coming-to-china/
Photographs around Microsoft #7,https://blogs.microsoft.com/ai/photographs-around-microsoft-7/
Aston Martin DB4 GT Zagato arrives on Forza 4,https://blogs.microsoft.com/ai/aston-martin-db4-gt-zagato-arrives-on-forza-4/
Windows 8 PCs Galore at IFA,https://blogs.microsoft.com/ai/windows-8-pcs-galore-at-ifa/
Microsoft Dynamics hits 212mph,https://blogs.microsoft.com/ai/microsoft-dynamics-hits-212mph/
Atari Arcade with Internet Explorer brings arcade classics to the web,https://blogs.microsoft.com/ai/atari-arcade-with-internet-explorer-brings-arcade-classics-to-the-web/
My favorite key in Windows 8,https://blogs.microsoft.com/ai/my-favorite-key-in-windows-8/
Microsoft Tag project blends the physical and digital worlds,https://blogs.microsoft.com/ai/microsoft-tag-project-blends-the-physical-and-digital-worlds/
Photographs around Microsoft #6,https://blogs.microsoft.com/ai/photographs-around-microsoft-6/
Microsoft’s new logo,https://blogs.microsoft.com/ai/microsofts-new-logo/
Nissan joins Audi and Ford with Kinect for Windows virtual showroom,https://blogs.microsoft.com/ai/nissan-joins-audi-and-ford-with-kinect-for-windows-virtual-showroom/
Microsoft Reimagines Paint,https://blogs.microsoft.com/ai/microsoft-reimagines-paint/
Best of Bing at the Olympics,https://blogs.microsoft.com/ai/best-of-bing-at-the-olympics/
Best of Kinect on NEXT,https://blogs.microsoft.com/ai/best-of-kinect-on-next/
Photographs around Microsoft #5,https://blogs.microsoft.com/ai/photographs-around-microsoft-5/
Big news for SkyDrive,https://blogs.microsoft.com/ai/big-news-for-skydrive/
New Windows Photo Gallery and Movie Maker,https://blogs.microsoft.com/ai/new-windows-photo-gallery-and-movie-maker/
The year so far on NEXT: Part 1,https://blogs.microsoft.com/ai/the-year-so-far-on-next-part-1/
"Netflix ""Just for Kids"" now on Xbox 360",https://blogs.microsoft.com/ai/netflix-just-for-kids-now-on-xbox-360/
30 minutes of NEXT demos,https://blogs.microsoft.com/ai/30-minutes-of-next-demos/
KinÊtre – Animating the World with the Human Body,https://blogs.microsoft.com/ai/kintre-animating-the-world-with-the-human-body/
Photographs around Microsoft #4,https://blogs.microsoft.com/ai/photographs-around-microsoft-4/
Forza August Playseat Car Pack,https://blogs.microsoft.com/ai/forza-august-playseat-car-pack/
Photographs around Microsoft #3,https://blogs.microsoft.com/ai/photographs-around-microsoft-3/
IKEA blends the physical and digital worlds,https://blogs.microsoft.com/ai/ikea-blends-the-physical-and-digital-worlds/
"If our habitats were programmable, what would we ask of them?",https://blogs.microsoft.com/ai/if-our-habitats-were-programmable-what-would-we-ask-of-them/
Outlook.com preview launches,https://blogs.microsoft.com/ai/outlook-com-preview-launches/
Audi reboots the car dealership with Kinect,https://blogs.microsoft.com/ai/audi-reboots-the-car-dealership-with-kinect/
New Microsoft mice and keyboards designed for Windows 8,https://blogs.microsoft.com/ai/new-microsoft-mice-and-keyboards-designed-for-windows-8/
Photographs around Microsoft #2,https://blogs.microsoft.com/ai/photographs-around-microsoft-2/
Kinect V Motion Project,https://blogs.microsoft.com/ai/kinect-v-motion-project/
PSFK: The Future of Retail,https://blogs.microsoft.com/ai/psfk-the-future-of-retail/
Another amazing Kinect project – the future of retail windows?,https://blogs.microsoft.com/ai/another-amazing-kinect-project-the-future-of-retail-windows/
The future of digital displays,https://blogs.microsoft.com/ai/the-future-of-digital-displays/
23 acre AIDS Memorial Quilt goes digital,https://blogs.microsoft.com/ai/23-acre-aids-memorial-quilt-goes-digital/
Camera Extras for Lumia phones,https://blogs.microsoft.com/ai/camera-extras-for-lumia-phones/
Aviary lands Photo Genius on Windows Phone,https://blogs.microsoft.com/ai/aviary-lands-photo-genius-on-windows-phone/
Follow the Olympics on Windows Phone,https://blogs.microsoft.com/ai/follow-the-olympics-on-windows-phone/
David Brown shows NUIverse on the Samsung SUR40 @ WPC 2012,https://blogs.microsoft.com/ai/david-brown-shows-nuiverse-on-the-samsung-sur40-wpc-2012/
Windows Phone 7.8 start screen,https://blogs.microsoft.com/ai/windows-phone-7-8-start-screen/
One More Reason to Get Off the Sofa and Shake It,https://blogs.microsoft.com/ai/one-more-reason-to-get-off-the-sofa-and-shake-it/
Photographs around Microsoft #1,https://blogs.microsoft.com/ai/photographs-around-microsoft-1/
Microsoft Research Faculty Summit 2012,https://blogs.microsoft.com/ai/microsoft-research-faculty-summit-2012/
Imagine Cup 2012: The Secret Sauce,https://blogs.microsoft.com/ai/imagine-cup-2012-the-secret-sauce/
Windows Phone is still smoking,https://blogs.microsoft.com/ai/windows-phone-is-still-smoking/
Next at Microsoft: LIVE in Toronto,https://blogs.microsoft.com/ai/next-at-microsoft-live-in-toronto/
Day 2 of Worldwide Partner Conference,https://blogs.microsoft.com/ai/day-2-of-worldwide-partner-conference/
Microsoft acquires Perceptive Pixel – 82” touch screen capability,https://blogs.microsoft.com/ai/microsoft-acquires-perceptive-pixel-82-touch-screen-capability/
Nokia Lumia scoops IDEA Design Awards,https://blogs.microsoft.com/ai/nokia-lumia-scoops-idea-design-awards/
July with Forza Motorsport,https://blogs.microsoft.com/ai/july-with-forza-motorsport/
Coming to you live from Worldwide Partner Conference,https://blogs.microsoft.com/ai/coming-to-you-live-from-worldwide-partner-conference/
Using robotics to train tomorrow’s scientists,https://blogs.microsoft.com/ai/using-robotics-to-train-tomorrows-scientists/
"Smartphones, sensors and the age of domestic drones",https://blogs.microsoft.com/ai/smartphones-sensors-and-the-age-of-domestic-drones/
Microsoft Research Cliplets gets animated GIF support,https://blogs.microsoft.com/ai/microsoft-research-cliplets-gets-animated-gif-support/
VIZIO joins the PC ranks,https://blogs.microsoft.com/ai/vizio-joins-the-pc-ranks/
Microsoft Accelerator for Kinect – Incubating with Kinect,https://blogs.microsoft.com/ai/microsoft-accelerator-for-kinect-incubating-with-kinect/
Microsoft Accelerator for Kinect Demo Day offers lots of VC options,https://blogs.microsoft.com/ai/microsoft-accelerator-for-kinect-demo-day-offers-lots-of-vc-options/
Bing Venue Maps Goes International,https://blogs.microsoft.com/ai/bing-venue-maps-goes-international/
Microsoft Accelerator for Kinect: Demo Day,https://blogs.microsoft.com/ai/microsoft-accelerator-for-kinect-demo-day/
Bing and PixelSense,https://blogs.microsoft.com/ai/bing-and-pixelsense/
Cannes Lions 2012: recap,https://blogs.microsoft.com/ai/cannes-lions-2012-recap/
Cannes Lions 2012 Highlights,https://blogs.microsoft.com/ai/cannes-lions-2012-highlights/
